{
  "$schema": "https://json-schema.org/draft/2020-12/schema",
  "$id": "https://example.invalid/glorys-current/pilot-config.schema.json",
  "title": "GLORYS12V1 pilot configuration",
  "type": "object",
  "additionalProperties": false,
  "required": [
    "aoi_id",
    "aoi_source",
    "crs",
    "west",
    "east",
    "south",
    "north",
    "earth_engine_project_id",
    "earth_engine_asset_root",
    "pilot_period"
  ],
  "properties": {
    "aoi_id": { "type": "string", "minLength": 1 },
    "aoi_source": { "type": "string", "minLength": 1 },
    "crs": { "const": "EPSG:4326" },
    "west": { "type": "number", "minimum": -180, "maximum": 180 },
    "east": { "type": "number", "minimum": -180, "maximum": 180 },
    "south": { "type": "number", "minimum": -90, "maximum": 90 },
    "north": { "type": "number", "minimum": -90, "maximum": 90 },
    "earth_engine_project_id": { "pattern": "^[a-z][a-z0-9-]{5,29}$" },
    "earth_engine_asset_root": {
      "pattern": "^projects/[a-z][a-z0-9-]{5,29}/assets/[A-Za-z0-9_-]+$"
    },
    "pilot_period": {
      "type": "object",
      "additionalProperties": false,
      "required": ["start", "end", "end_inclusive"],
      "properties": {
        "start": { "const": "2020-02-01" },
        "end": { "const": "2020-03-01" },
        "end_inclusive": { "const": false }
      }
    }
  }
}
